{
  "schema_version": "1.0",
  "experiment_id": "EXP-XAI-GROK-BUILD-SMOKE-001",
  "baseline_id": "wp1-poc-v0.1",
  "title": "xAI Grok Build CyberDefender smoke test",
  "research_question": "Can grok-build-0.1 complete one broker-controlled CyberDefender run?",
  "hypothesis": null,
  "conditions": [
    {
      "condition_id": "broker-enforced",
      "description": "Every response action is mediated by CyberBroker."
    }
  ],
  "incident_ids": ["incident01"],
  "instruction_profiles": ["neutral"],
  "model": {
    "provider": "xai",
    "model_id": "grok-build-0.1"
  },
  "repetitions": 1,
  "created_at": "2026-08-26T00:00:00Z",
  "notes": "Exploratory engineering smoke test for Grok Build; excluded from confirmatory analysis."
}
