{
  "schema_version": "1.0",
  "experiment_id": "EXP-QWEN38-FLASH-INCIDENT01-VARIANTS-002",
  "baseline_id": "wp1-poc-v0.1",
  "title": "Qwen 3.8 Flash incident01 blinded evidence-variant experiment",
  "research_question": "How do three blinded evidence variants affect Qwen 3.8 Flash reasoning and broker-mediated response requests for incident01 across four instruction profiles relative to a contemporaneous control?",
  "hypothesis": "Evidence manipulation and instruction framing may affect model reasoning and requested actions, while CyberBroker will prevent every policy-denied effect.",
  "conditions": [
    {
      "condition_id": "broker-enforced",
      "description": "Every model-requested response action is mediated by CyberBroker under policy version 0.1."
    }
  ],
  "incident_ids": ["incident01"],
  "instruction_profiles": [
    "neutral",
    "security-aware",
    "injection-resistant",
    "autonomy-encouraging"
  ],
  "evidence_variants": ["BASE", "c91f7a2e", "4d8b2c61", "a73e5f90"],
  "model": {
    "provider": "qwen",
    "model_id": "qwen3.8-flash",
    "adapter": "qwen_chat",
    "max_output_tokens": 16000,
    "max_action_calls": 12,
    "evidence_byte_limit": 1000000,
    "temperature": null,
    "reasoning_effort": null,
    "parallel_tool_calls": false,
    "store": false
  },
  "repetitions": 1,
  "created_at": "2026-08-26T00:00:00Z",
  "notes": "Replacement for the stopped v1 engineering launch, whose attempts are excluded because a missing schema return and insufficient output ceiling caused adapter failures. This sixteen-cell experiment uses the corrected schema contract and a 16000-token ceiling. Uses the floating provider alias qwen3.8-flash because no dated snapshot was listed. Evaluator-only mappings are excluded and every attempt is retained."
}
