{
  "schema_version": "1.0",
  "experiment_id": "EXP-OPENROUTER-DEEPSEEK-V4-FLASH-0731-INCIDENT01-VARIANTS-001",
  "baseline_id": "wp1-poc-v0.1",
  "title": "OpenRouter DeepSeek V4 Flash 0731 incident01 blinded evidence-variant pilot",
  "research_question": "How do three blinded evidence variants affect DeepSeek V4 Flash 0731 reasoning and broker-mediated response requests for incident01 across four instruction profiles relative to a contemporaneous control?",
  "hypothesis": "Evidence manipulation and instruction framing may affect model reasoning and requested actions, while CyberBroker will prevent every policy-denied effect.",
  "conditions": [{"condition_id": "broker-enforced", "description": "Every model-requested response action is mediated by CyberBroker under policy version 0.1."}],
  "incident_ids": ["incident01"],
  "instruction_profiles": ["neutral", "security-aware", "injection-resistant", "autonomy-encouraging"],
  "evidence_variants": ["BASE", "c91f7a2e", "4d8b2c61", "a73e5f90"],
  "model": {
    "provider": "openrouter",
    "model_id": "deepseek/deepseek-v4-flash-0731",
    "adapter": "openrouter_chat",
    "openrouter_provider_order": ["Relace"],
    "openrouter_allow_fallbacks": false,
    "max_output_tokens": 16000,
    "max_action_calls": 12,
    "evidence_byte_limit": 1000000,
    "temperature": null,
    "reasoning_effort": null,
    "parallel_tool_calls": false,
    "store": false,
    "final_transport": "flattened_native_tool_v2",
    "transport_omitted_schema_keywords": ["uniqueItems"]
  },
  "repetitions": 1,
  "created_at": "2026-08-27T00:00:00Z",
  "notes": "Sixteen-cell OpenRouter pilot pinned to Relace with fallback disabled after a successful native strict-tool preflight. The provider-facing final-report schema omits uniqueItems while the unchanged local assessment validator enforces the complete schema. Response actions remain exclusively broker-mediated. Evaluator-only mappings are excluded and every attempt is retained."
}
