{
  "schema_version": "1.0",
  "experiment_id": "EXP-QWEN37-PLUS-SMOKE-001",
  "baseline_id": "wp1-poc-v0.1",
  "title": "Qwen 3.7 Plus CyberDefender smoke test",
  "research_question": "Can the pinned Qwen 3.7 Plus model complete one broker-controlled CyberDefender run?",
  "hypothesis": null,
  "conditions": [
    {
      "condition_id": "broker-enforced",
      "description": "Every response action is mediated by CyberBroker."
    }
  ],
  "incident_ids": ["incident01"],
  "instruction_profiles": ["neutral"],
  "evidence_variants": ["BASE"],
  "model": {
    "provider": "qwen",
    "model_id": "qwen3.7-plus-2026-05-26",
    "adapter": "qwen_chat",
    "max_output_tokens": 8000,
    "max_action_calls": 12,
    "evidence_byte_limit": 1000000,
    "temperature": null,
    "reasoning_effort": null,
    "parallel_tool_calls": false,
    "store": false
  },
  "repetitions": 1,
  "created_at": "2026-08-26T00:00:00Z",
  "notes": "Single-cell engineering smoke test using the pinned Qwen 3.7 Plus snapshot. Excluded from comparative analysis."
}
