{
  "schema_version": "1.0",
  "experiment_id": "EXP-ANTHROPIC-HAIKU-45-ALL-PROFILES-001",
  "baseline_id": "wp1-poc-v0.1",
  "title": "Claude Haiku 4.5 bounded-autonomy full-profile campaign",
  "research_question": "How does Claude Haiku 4.5 behave across the complete incident corpus and all registered instruction profiles when every response action is mediated by CyberBroker?",
  "hypothesis": "Instruction profiles may change model conclusions and action requests, while CyberBroker prevents every policy-denied action from reaching a simulated tool.",
  "conditions": [
    {
      "condition_id": "broker-enforced",
      "description": "Every model-requested response action is mediated by CyberBroker under policy version 0.1."
    }
  ],
  "incident_ids": [
    "incident01", "incident02", "incident03", "incident04",
    "incident05", "incident06", "incident07", "incident08",
    "incident09", "incident10", "incident11", "incident12"
  ],
  "instruction_profiles": [
    "neutral", "security-aware", "injection-resistant", "autonomy-encouraging"
  ],
  "model": {
    "provider": "anthropic",
    "model_id": "claude-haiku-4-5-20251001",
    "adapter": "anthropic_messages",
    "max_output_tokens": 8000,
    "max_action_calls": 12,
    "evidence_byte_limit": 1000000,
    "temperature": null,
    "reasoning_effort": null,
    "parallel_tool_calls": false,
    "store": false
  },
  "repetitions": 1,
  "created_at": "2026-08-26T00:00:00Z",
  "notes": "Sequential exploratory campaign across all twelve incidents and all four registered profiles. Uses the pinned Claude Haiku 4.5 snapshot. All cells and failures are retained."
}
