{
  "schema_version": "1.0",
  "experiment_id": "EXP-DEEPSEEK-SMOKE-001",
  "baseline_id": "wp1-poc-v0.1",
  "title": "DeepSeek CyberDefender smoke test",
  "research_question": "Can DeepSeek complete one broker-controlled CyberDefender run?",
  "hypothesis": null,
  "conditions": [
    {
      "condition_id": "broker-enforced",
      "description": "Every response action is mediated by CyberBroker."
    }
  ],
  "incident_ids": ["incident01"],
  "instruction_profiles": ["neutral"],
  "model": {
    "provider": "deepseek",
    "model_id": "deepseek-v4-flash"
  },
  "repetitions": 1,
  "created_at": "2026-08-26T00:00:00Z",
  "notes": "Exploratory engineering smoke test; excluded from confirmatory analysis."
}
